{
  "contracts": {
    "provides": [
      {
        "cardinality": "one",
        "failure": "fail_closed",
        "id": "rumi.service.file.patch.v1",
        "isolation": "in_process",
        "lifecycle": {
          "deprecated": false,
          "introduced": "1.0.0"
        },
        "provider_instance_id": "file-patch.service",
        "required_capabilities": [
          "file.patch"
        ],
        "schemas": {
          "input": {
            "type": "object"
          },
          "output": {
            "type": "object"
          }
        },
        "security": "restricted",
        "version": "1.0.0"
      }
    ],
    "requires": [
      {
        "cardinality": "one",
        "id": "rumi.resource.workspace.v1",
        "optional": false,
        "version_range": ">=1.0.0 <2.0.0"
      },
      {
        "cardinality": "one",
        "id": "rumi.service.host.authorize.v1",
        "optional": false,
        "version_range": ">=1.0.0 <2.0.0"
      }
    ]
  },
  "entrypoints": [
    {
      "artifact_hash": "sha256:c706fc33ef41284698a398f2f3742c0352f325eaf95acbd7448f0a4cfa68d416",
      "contract_id": "rumi.service.file.patch.v1",
      "id": "file-patch",
      "loader": "python",
      "module": "ecosystem.rumi_file_patch_pack.runtime.patch",
      "symbol": "create_file_patch_operation"
    }
  ],
  "extensions": {
    "rumi.file_patch.boundary": {
      "apply_receipt": "required",
      "atomic_replace": true,
      "old_match_count": 1,
      "post_authorization_recheck": true,
      "preview_without_write": true,
      "stale_hash": "fail_closed"
    },
    "rumi.legacy_projection": {
      "dependencies": {
        "rumi_host_authority_bridge_pack": ">=1.0.0,<2.0.0",
        "rumi_workspace_mount_pack": ">=1.0.0,<2.0.0"
      },
      "host_execution": true,
      "manifest": {
        "connectivity": {
          "provides": [
            "rumi.service.file.patch.v1"
          ],
          "requires": [
            "rumi.resource.workspace.v1",
            "rumi.service.host.authorize.v1"
          ]
        },
        "dependencies": {
          "rumi_host_authority_bridge_pack": ">=1.0.0,<2.0.0",
          "rumi_workspace_mount_pack": ">=1.0.0,<2.0.0"
        },
        "description": "Previewable receipt-gated exact text patching.",
        "display_name": "Rumi File Patch",
        "host_execution": true,
        "metadata": {
          "apply_receipt_required": true,
          "authority": "patch",
          "canonical_v4": {
            "artifact": "pack.v4.json",
            "artifact_digest": "sha256:b64150979768bb0e76bb1cb3390bdc9217bde28d74db7a7260d50be44d0c75fc",
            "generator": "tobkiri.scripts.migrate_manifest_authority/v2",
            "source_identity": "sha256:e0ce143ae186b46a42ee441c830bc67715803d3338ae19d46b713a03e442fd5b"
          },
          "preview": "read_only",
          "tool_or_ui_registry_imports": false
        },
        "pack_id": "rumi_file_patch_pack",
        "pack_identity": "rumi:ecosystem/rumi_file_patch_pack",
        "provenance": {
          "build_identity": "rumi_file_patch_pack:1.0.0",
          "content_hash": "sha256:c706fc33ef41284698a398f2f3742c0352f325eaf95acbd7448f0a4cfa68d416",
          "signature": null,
          "trust_class": "local"
        },
        "required_capabilities": [
          "file.patch",
          "host.authority.consume",
          "workspace.metadata.read"
        ],
        "required_network": {
          "allowed_domains": [],
          "allowed_ports": []
        },
        "required_secrets": [],
        "resources": [],
        "version": "1.0.0",
        "vocabulary": {
          "types": [
            "service"
          ]
        }
      },
      "pack_id": "rumi_file_patch_pack"
    }
  },
  "migration": {
    "compatibility_aliases": [],
    "compatibility_projection": "legacy_to_v3_read_only",
    "from": [
      "defaultspack.domain.coding.file_ops.apply_patch_text",
      "defaultspack.blocks.coding.file_patch"
    ],
    "removal_wave": 10,
    "rollback": "Apply the inverse previewed patch or restore from caller-held checkpoint.",
    "sunset_at": "2027-12-31"
  },
  "pack": {
    "description": "Previewable receipt-gated exact text patching.",
    "display_name": "Rumi File Patch",
    "id": "rumi.file_patch",
    "kind": "service",
    "version": "1.0.0"
  },
  "pack_api_version": "rumi.pack.v3",
  "permissions": [
    {
      "access": "write",
      "approval_required": true,
      "capability": "file.patch"
    },
    {
      "access": "read",
      "approval_required": false,
      "capability": "workspace.metadata.read"
    },
    {
      "access": "control",
      "approval_required": false,
      "capability": "host.authority.consume"
    }
  ],
  "provenance": {
    "build_identity": "rumi_file_patch_pack:1.0.0",
    "content_hash": "sha256:c706fc33ef41284698a398f2f3742c0352f325eaf95acbd7448f0a4cfa68d416",
    "signature": null,
    "trust_class": "local"
  },
  "resources": [],
  "storage": []
}
