{
  "contracts": {
    "provides": [
      {
        "cardinality": "many",
        "failure": "isolate",
        "id": "rumi.service.connector.adapter.v1",
        "instance_key": "http_api",
        "isolation": "process",
        "lifecycle": {
          "deprecated": false,
          "introduced": "1.0.0"
        },
        "provider_instance_id": "connector.http_api",
        "required_capabilities": [
          "connector.adapter.verify",
          "connector.delivery.execute"
        ],
        "schemas": {
          "input": {
            "type": "object"
          },
          "output": {
            "type": "object"
          }
        },
        "security": "restricted",
        "version": "1.0.0"
      }
    ],
    "requires": [
      {
        "cardinality": "one",
        "id": "rumi.service.credential.resolve.v1",
        "optional": false,
        "version_range": ">=1.0.0,<2.0.0"
      },
      {
        "cardinality": "one",
        "id": "rumi.service.host.authorize.v1",
        "optional": false,
        "version_range": ">=1.0.0,<2.0.0"
      }
    ]
  },
  "entrypoints": [
    {
      "artifact_hash": "sha256:26a12d4a2400757ccf22c0678f570afca759a725375ed7487046bc430580c28c",
      "contract_id": "rumi.service.connector.adapter.v1",
      "id": "http-api-adapter",
      "loader": "python",
      "module": "ecosystem.rumi_http_api_connector_pack.runtime.adapter",
      "symbol": "create_connector_adapter"
    }
  ],
  "extensions": {
    "rumi.connector_adapter.boundary": {
      "chat_imports": false,
      "company_imports": false,
      "credential_scope_bound": true,
      "https_only": true,
      "idempotency_key_required": true,
      "inbound_auth": "bearer-constant-time",
      "outbound_receipt": true,
      "private_network": false,
      "redirects": false,
      "vendor": "http_api"
    },
    "rumi.legacy_projection": {
      "dependencies": {
        "rumi_credential_broker_pack": ">=1.0.0,<2.0.0",
        "rumi_host_authority_bridge_pack": ">=1.0.0,<2.0.0"
      },
      "host_execution": true,
      "manifest": {
        "connectivity": {
          "provides": [
            "rumi.service.connector.adapter.v1"
          ],
          "requires": [
            "rumi.service.credential.resolve.v1",
            "rumi.service.host.authorize.v1"
          ]
        },
        "dependencies": {
          "rumi_credential_broker_pack": ">=1.0.0,<2.0.0",
          "rumi_host_authority_bridge_pack": ">=1.0.0,<2.0.0"
        },
        "description": "Bearer-authenticated API normalization and HTTPS callbacks.",
        "display_name": "Rumi HTTP API Connector",
        "host_execution": true,
        "metadata": {
          "authoritative_owner": false,
          "owner_surfaces": []
        },
        "pack_id": "rumi_http_api_connector_pack",
        "pack_identity": "rumi:ecosystem/rumi_http_api_connector_pack",
        "provenance": {
          "build_identity": "rumi-http-api-connector-pack:1.0.0",
          "content_hash": "sha256:26a12d4a2400757ccf22c0678f570afca759a725375ed7487046bc430580c28c",
          "signature": null,
          "trust_class": "local"
        },
        "required_capabilities": [
          "connector.adapter.verify",
          "connector.delivery.execute",
          "credential.resolve",
          "host.authority.consume"
        ],
        "required_network": {
          "allowed_domains": [],
          "allowed_ports": []
        },
        "required_secrets": [],
        "resources": [],
        "version": "1.0.0",
        "vocabulary": {
          "types": [
            "service"
          ]
        }
      },
      "pack_id": "rumi_http_api_connector_pack"
    }
  },
  "migration": {
    "compatibility_aliases": [],
    "compatibility_projection": "legacy_to_v3_read_only",
    "from": [
      "defaultspack.transport.http",
      "defaultspack.domain.external.http_api"
    ],
    "removal_wave": 10,
    "rollback": "Disable API ingress and select one prior adapter after replay-ledger preservation.",
    "sunset_at": "2027-12-31"
  },
  "pack": {
    "description": "Bearer-authenticated API normalization and HTTPS callbacks.",
    "display_name": "Rumi HTTP API Connector",
    "id": "rumi.http_api_connector",
    "kind": "provider",
    "version": "1.0.0"
  },
  "pack_api_version": "rumi.pack.v3",
  "permissions": [
    {
      "access": "execute",
      "approval_required": false,
      "capability": "connector.adapter.verify"
    },
    {
      "access": "execute",
      "approval_required": true,
      "capability": "connector.delivery.execute"
    },
    {
      "access": "execute",
      "approval_required": false,
      "capability": "credential.resolve"
    },
    {
      "access": "control",
      "approval_required": false,
      "capability": "host.authority.consume"
    }
  ],
  "provenance": {
    "build_identity": "rumi-http-api-connector-pack:1.0.0",
    "content_hash": "sha256:26a12d4a2400757ccf22c0678f570afca759a725375ed7487046bc430580c28c",
    "signature": null,
    "trust_class": "local"
  },
  "resources": [],
  "storage": []
}
