{
  "contracts": {
    "provides": [],
    "requires": []
  },
  "entrypoints": [],
  "extensions": {
    "rumi.legacy_projection": {
      "dependencies": {
        "defaultspack": ">=2.0.0"
      },
      "host_execution": false,
      "manifest": {
        "components": {},
        "connectivity": {
          "provides": [],
          "requires": []
        },
        "dependencies": {
          "defaultspack": ">=2.0.0"
        },
        "description": "Customer research workflow and UI content without host authority.",
        "display_name": "Rumi Customer Research Content",
        "host_execution": false,
        "load_order": [],
        "metadata": {
          "asset_index": {
            "catalog": [
              "catalog/workflows.yaml",
              "catalog/quality_matrix.yaml",
              "catalog/taxonomy.yaml",
              "catalog/handoff_matrix.yaml"
            ],
            "checklist": [
              "checklists/review.checklist.yaml"
            ],
            "docs": [
              "docs/README.md",
              "docs/architecture.md",
              "docs/interfaces.md",
              "docs/operations.md"
            ],
            "example": [
              "examples/feedback_opportunity_card.example.yaml",
              "examples/interview_synthesis.example.yaml",
              "examples/revoked_consent_filter.example.yaml",
              "examples/survey_theme_map.example.yaml"
            ],
            "fixtures": [
              "fixtures/contract_fixture.yaml",
              "fixtures/negative_cases.yaml"
            ],
            "index": [
              "asset_index.yaml"
            ],
            "ledger": [
              "ledgers/evidence_ledger.schema.yaml"
            ],
            "policy": [
              "policies/safety.policy.yaml",
              "policies/handoff.policy.yaml"
            ],
            "presets": [
              "presets/safe_default.preset.yaml",
              "presets/handoff_review.preset.yaml",
              "presets/quality_gate.preset.yaml"
            ],
            "profiles": [
              "profiles/customer_researcher.profile.yaml"
            ],
            "prompts": [
              "prompts/insight_synthesizer.system.md"
            ],
            "readme": [
              "README.md"
            ],
            "schema": [
              "schemas/consent_record.schema.json",
              "schemas/insight_card.schema.json",
              "schemas/interview_evidence.schema.json",
              "schemas/opportunity_map.schema.json",
              "schemas/participant.schema.json",
              "schemas/survey_response.schema.json"
            ],
            "template": [
              "templates/handoff.template.md",
              "templates/review_report.template.md",
              "templates/artifact_card.template.md"
            ]
          },
          "canonical_v4": {
            "artifact": "pack.v4.json",
            "artifact_digest": "sha256:7de11ca67c52f4b84bb69da1716c18ccd19048dd1b61eb11ee4e05e48f6a4e24",
            "generator": "tobkiri.scripts.migrate_manifest_authority/v2",
            "source_identity": "sha256:c39beae899f99186fac7d3e5c12c806960c2ca8f3df8f346f46935fedad57ada"
          },
          "consumes_existing_sources_only": true,
          "declarative_only": true,
          "defaultspack_promotion_eligible": false,
          "executable_code": false,
          "integrity": {
            "artifact_manifest": "artifact-manifest.json"
          },
          "network_policy": "none_by_default",
          "non_owner_surfaces": [
            "live recruiting",
            "email or CRM writes",
            "generic web research",
            "product roadmap decisions",
            "analytics query execution",
            "contact enrichment",
            "message sending"
          ],
          "optional_integrations": [
            {
              "pack_id": "rumi_connector_gateway_pack",
              "reason": "Recruiting, calendar, and source system retrieval are connector-owned."
            },
            {
              "pack_id": "rumi_business_ops_pack",
              "reason": "CRM writes, outbound email, and business workflow execution remain outside this pack."
            },
            {
              "pack_id": "rumi_research_pack",
              "reason": "General web research and market scans remain research-owned."
            },
            {
              "pack_id": "rumi_data_analysis_pack",
              "reason": "Large survey statistics and analytics queries are data-analysis-owned."
            },
            {
              "pack_id": "rumi_meeting_intelligence_pack",
              "reason": "Raw call or meeting transcript normalization is meeting-intelligence-owned."
            }
          ],
          "output_effect": "draft_and_handoff_only",
          "owner_surfaces": [
            "participant_consent_record",
            "research_redaction_policy",
            "interview_evidence",
            "survey_synthesis",
            "feedback_to_insight_card",
            "opportunity_map",
            "evidence_linked_research_brief"
          ],
          "required_secrets": [],
          "runtime_type": "declarative_setup_pack"
        },
        "pack_id": "rumi_customer_research_pack",
        "pack_identity": "rumi:ecosystem/rumi_customer_research_pack",
        "provenance": {
          "build_identity": "rumi_customer_research_pack:1.0.0",
          "content_hash": "sha256:17d8811e7cec99871443a75d69fb07bec5d220b6a2873ad19f8ed2e964bb5ba8",
          "signature": null,
          "trust_class": "local"
        },
        "required_capabilities": [],
        "required_network": {
          "allowed_domains": [],
          "allowed_ports": []
        },
        "required_secrets": [],
        "resources": [
          "frontend/contributions/customer-research.json"
        ],
        "version": "1.0.0",
        "vocabulary": {
          "types": [
            "catalog",
            "schema",
            "policy",
            "checklist",
            "ledger",
            "template",
            "fixture",
            "profile",
            "prompt",
            "preset",
            "example"
          ]
        }
      },
      "pack_id": "rumi_customer_research_pack"
    },
    "rumi.product_content.boundary": {
      "host_authority": false,
      "host_imports": false,
      "product": "customer_research",
      "profile_scoped": true
    }
  },
  "migration": {
    "compatibility_aliases": [],
    "compatibility_projection": "legacy_to_v3_read_only",
    "from": [
      "defaultspack.webapp.customer_research"
    ],
    "removal_wave": 10,
    "rollback": "Remove the selected product pack projection; no host state is owned.",
    "sunset_at": "2027-12-31"
  },
  "pack": {
    "description": "Customer research workflow and UI content without host authority.",
    "display_name": "Rumi Customer Research Content",
    "id": "rumi.customer_research",
    "kind": "content",
    "version": "1.0.0"
  },
  "pack_api_version": "rumi.pack.v3",
  "permissions": [],
  "provenance": {
    "build_identity": "rumi_customer_research_pack:1.0.0",
    "content_hash": "sha256:17d8811e7cec99871443a75d69fb07bec5d220b6a2873ad19f8ed2e964bb5ba8",
    "signature": null,
    "trust_class": "local"
  },
  "resources": [
    {
      "content_hash": "sha256:083b6a99b7b5cd6c59dbc1fa2af992d6cef024b34a641f592ea2d269910ee224",
      "id": "frontend/contributions/customer-research.json",
      "kind": "ui.contribution"
    }
  ],
  "storage": []
}
