{
  "pack_api_version": "rumi.pack.v3",
  "pack": {"id": "rumi.ai_pipeline", "version": "1.0.0", "kind": "service", "display_name": "Rumi AI Pipeline", "description": "Replaceable request normalization and replay-safe failover decisions."},
  "contracts": {
    "provides": [
      {"id": "rumi.service.ai.request.prepare.v1", "version": "1.0.0", "provider_instance_id": "ai-pipeline.prepare", "cardinality": "one", "security": "sensitive", "failure": "fail_closed", "lifecycle": {"introduced": "1.0.0", "deprecated": false, "data_owner": "rumi_ai_pipeline_pack"}, "schemas": {"input": {"type": "object"}, "output": {"type": "object"}}, "isolation": "in_process", "required_capabilities": ["ai.request.prepare"]},
      {"id": "rumi.service.ai.failover.decide.v1", "version": "1.0.0", "provider_instance_id": "ai-pipeline.failover", "cardinality": "one", "security": "sensitive", "failure": "fail_closed", "lifecycle": {"introduced": "1.0.0", "deprecated": false, "data_owner": "rumi_ai_pipeline_pack"}, "schemas": {"input": {"type": "object"}, "output": {"type": "object"}}, "isolation": "in_process", "required_capabilities": ["ai.failover.decide"]}
    ],
    "requires": []
  },
  "entrypoints": [
    {"id": "ai-request-prepare", "contract_id": "rumi.service.ai.request.prepare.v1", "loader": "python", "module": "ecosystem.rumi_ai_pipeline_pack.runtime.pipeline", "symbol": "create_prepare_operation", "artifact_hash": "sha256:ac0a26fc6dbce4d7baf68ecb17c18c5a96c4c1442b409d34c9ca2fb1ae2bd508"},
    {"id": "ai-failover-decide", "contract_id": "rumi.service.ai.failover.decide.v1", "loader": "python", "module": "ecosystem.rumi_ai_pipeline_pack.runtime.pipeline", "symbol": "create_failover_operation", "artifact_hash": "sha256:ac0a26fc6dbce4d7baf68ecb17c18c5a96c4c1442b409d34c9ca2fb1ae2bd508"}
  ],
  "resources": [],
  "storage": [],
  "permissions": [
    {"capability": "ai.request.prepare", "access": "execute", "approval_required": false},
    {"capability": "ai.failover.decide", "access": "execute", "approval_required": false}
  ],
  "provenance": {"content_hash": "sha256:ac0a26fc6dbce4d7baf68ecb17c18c5a96c4c1442b409d34c9ca2fb1ae2bd508", "build_identity": "rumi-ai-pipeline-pack:1.0.0", "trust_class": "local", "signature": null},
  "migration": {"from": ["rumi_ai_gateway_pack.runtime.gateway._deadline", "rumi_ai_gateway_pack.runtime.gateway.failover"], "compatibility_aliases": [], "compatibility_projection": "none", "removal_wave": 10, "sunset_at": "2027-12-31", "rollback": "Select the pinned prior request and failover providers."},
  "extensions": {"rumi.ai_pipeline.boundary": {"provider_execution": false, "raw_credentials": false, "tool_failover": false, "idempotency_required": true}}
}
