{
  "contracts": {
    "provides": [
      {
        "cardinality": "many",
        "failure": "isolate",
        "id": "rumi.action.connector.route.v1",
        "instance_key": "company",
        "isolation": "in_process",
        "lifecycle": {
          "data_owner": "rumi_company_state_store_pack",
          "deprecated": false,
          "introduced": "1.0.0"
        },
        "provider_instance_id": "connector-route.company",
        "required_capabilities": [
          "connector.route"
        ],
        "schemas": {
          "input": {
            "type": "object"
          },
          "output": {
            "type": "object"
          }
        },
        "security": "sensitive",
        "version": "1.0.0"
      }
    ],
    "requires": [
      {
        "cardinality": "one",
        "id": "rumi.resource.company.v1",
        "optional": false,
        "version_range": ">=1.0.0 <2.0.0"
      },
      {
        "cardinality": "one",
        "id": "rumi.action.company.state.v1",
        "optional": false,
        "version_range": ">=1.0.0 <2.0.0"
      },
      {
        "cardinality": "one",
        "id": "rumi.action.company.coordinator.v1",
        "optional": false,
        "version_range": ">=1.0.0 <2.0.0"
      },
      {
        "cardinality": "one",
        "id": "rumi.service.host.authorize.v1",
        "optional": false,
        "version_range": ">=1.0.0 <2.0.0"
      }
    ]
  },
  "entrypoints": [
    {
      "artifact_hash": "sha256:585a6c6e0f2ed28c4d478eb4eaf39df73cbe3e4df9d2f7eb5196058bfc816a6d",
      "contract_id": "rumi.action.connector.route.v1",
      "id": "connector-company-route",
      "loader": "python",
      "module": "ecosystem.rumi_connector_company_adapter_pack.runtime.adapter",
      "symbol": "create_connector_route"
    }
  ],
  "extensions": {
    "rumi.connector_route.boundary": {
      "company_imports": false,
      "connector_imports": false,
      "coordinator_imports": false,
      "credential_reference_visible": false,
      "deterministic_inbound_id": true,
      "explicit_company_id_required": true,
      "explicit_route_required": true,
      "raw_body_visible": false,
      "separate_authority_receipts": true,
      "target": "company"
    },
    "rumi.legacy_projection": {
      "dependencies": {
        "rumi_company_coordinator_pack": ">=1.0.0,<2.0.0",
        "rumi_company_state_store_pack": ">=1.0.0,<2.0.0",
        "rumi_host_authority_bridge_pack": ">=1.0.0,<2.0.0"
      },
      "host_execution": false,
      "manifest": {
        "connectivity": {
          "provides": [
            "rumi.action.connector.route.v1"
          ],
          "requires": [
            "rumi.action.company.coordinator.v1",
            "rumi.action.company.state.v1",
            "rumi.resource.company.v1",
            "rumi.service.host.authorize.v1"
          ]
        },
        "dependencies": {
          "rumi_company_coordinator_pack": ">=1.0.0,<2.0.0",
          "rumi_company_state_store_pack": ">=1.0.0,<2.0.0",
          "rumi_host_authority_bridge_pack": ">=1.0.0,<2.0.0"
        },
        "description": "Explicit connector-event projection into Company contracts.",
        "display_name": "Rumi Connector Company Adapter",
        "host_execution": false,
        "metadata": {
          "authoritative_owner": false,
          "owner_surfaces": []
        },
        "pack_id": "rumi_connector_company_adapter_pack",
        "pack_identity": "rumi:ecosystem/rumi_connector_company_adapter_pack",
        "provenance": {
          "build_identity": "rumi-connector-company-adapter-pack:1.0.0",
          "content_hash": "sha256:102fc346bfcc24fda4b0543acd26ab34407fb4dd6267d3d5a02fd0ea0a20bd5f",
          "signature": null,
          "trust_class": "local"
        },
        "required_capabilities": [
          "company.coordinate",
          "company.state.manage",
          "company.state.read",
          "connector.route",
          "host.authority.consume"
        ],
        "required_network": {
          "allowed_domains": [],
          "allowed_ports": []
        },
        "required_secrets": [],
        "resources": [],
        "version": "1.0.0",
        "vocabulary": {
          "types": [
            "service"
          ]
        }
      },
      "pack_id": "rumi_connector_company_adapter_pack"
    }
  },
  "migration": {
    "compatibility_aliases": [],
    "compatibility_projection": "legacy_to_v3_read_only",
    "from": [
      "defaultspack.domain.external.company_bridge",
      "defaultspack.domain.company.inbound"
    ],
    "removal_wave": 10,
    "rollback": "Remove this projection; connector and Company owners remain independent.",
    "sunset_at": "2027-12-31"
  },
  "pack": {
    "description": "Explicit connector-event projection into Company contracts.",
    "display_name": "Rumi Connector Company Adapter",
    "id": "rumi.connector_company_adapter",
    "kind": "adapter",
    "version": "1.0.0"
  },
  "pack_api_version": "rumi.pack.v3",
  "permissions": [
    {
      "access": "execute",
      "approval_required": false,
      "capability": "connector.route"
    },
    {
      "access": "read",
      "approval_required": false,
      "capability": "company.state.read"
    },
    {
      "access": "write",
      "approval_required": false,
      "capability": "company.state.manage"
    },
    {
      "access": "execute",
      "approval_required": false,
      "capability": "company.coordinate"
    },
    {
      "access": "control",
      "approval_required": false,
      "capability": "host.authority.consume"
    }
  ],
  "provenance": {
    "build_identity": "rumi-connector-company-adapter-pack:1.0.0",
    "content_hash": "sha256:102fc346bfcc24fda4b0543acd26ab34407fb4dd6267d3d5a02fd0ea0a20bd5f",
    "signature": null,
    "trust_class": "local"
  },
  "resources": [],
  "storage": []
}
