{
  "contracts": {
    "provides": [
      {
        "cardinality": "one",
        "failure": "fail_closed",
        "id": "rumi.service.context.v1",
        "isolation": "in_process",
        "lifecycle": {
          "deprecated": false,
          "introduced": "1.0.0"
        },
        "provider_instance_id": "context-runtime.materialize",
        "required_capabilities": [
          "context.materialize"
        ],
        "schemas": {
          "input": {
            "type": "object"
          },
          "output": {
            "type": "object"
          }
        },
        "security": "sensitive",
        "version": "1.0.0"
      }
    ],
    "requires": [
      {
        "cardinality": "one",
        "id": "rumi.resource.conversation.v1",
        "optional": false,
        "version_range": ">=1.0.0 <2.0.0"
      },
      {
        "cardinality": "one",
        "id": "rumi.resource.memory.v1",
        "optional": false,
        "version_range": ">=1.0.0 <2.0.0"
      },
      {
        "cardinality": "one",
        "id": "rumi.resource.knowledge.v1",
        "optional": false,
        "version_range": ">=1.0.0 <2.0.0"
      }
    ]
  },
  "entrypoints": [
    {
      "artifact_hash": "sha256:0f5cf7acdb2419c0f921b100506eee87acd21681a4f7ae88814a999a97deea33",
      "contract_id": "rumi.service.context.v1",
      "id": "context-materialize",
      "loader": "python",
      "module": "ecosystem.rumi_context_runtime_pack.runtime.materializer",
      "symbol": "create_context_operation"
    }
  ],
  "extensions": {
    "rumi.context_runtime.boundary": {
      "authoritative": false,
      "first_found_fallback": false,
      "persistent_storage": false,
      "source_contracts_only": true
    },
    "rumi.legacy_projection": {
      "dependencies": {
        "rumi_conversation_store_pack": ">=1.0.0,<2.0.0",
        "rumi_knowledge_store_pack": ">=1.0.0,<2.0.0",
        "rumi_memory_store_pack": ">=1.0.0,<2.0.0"
      },
      "host_execution": true,
      "manifest": {
        "connectivity": {
          "provides": [
            "rumi.service.context.v1"
          ],
          "requires": [
            "rumi.resource.conversation.v1",
            "rumi.resource.knowledge.v1",
            "rumi.resource.memory.v1"
          ]
        },
        "dependencies": {
          "rumi_conversation_store_pack": ">=1.0.0,<2.0.0",
          "rumi_knowledge_store_pack": ">=1.0.0,<2.0.0",
          "rumi_memory_store_pack": ">=1.0.0,<2.0.0"
        },
        "description": "Deterministic non-authoritative context materialization.",
        "display_name": "Rumi Context Runtime",
        "host_execution": true,
        "metadata": {
          "authoritative_owner": false,
          "canonical_v4": {
            "artifact": "pack.v4.json",
            "artifact_digest": "sha256:2abb7694d7047206ca317c76bc518433cb99aded2439d99b63d1a2d73e132d93",
            "generator": "tobkiri.scripts.migrate_manifest_authority/v2",
            "source_identity": "sha256:c23b43789040ff28add7c33c5a69d9ab80696e68a5a26c887d1fc7f1ffbf2d1c"
          },
          "owner_surfaces": [],
          "security": {
            "first_found_fallback": false,
            "persistent_storage": false
          }
        },
        "pack_id": "rumi_context_runtime_pack",
        "pack_identity": "rumi:ecosystem/rumi_context_runtime_pack",
        "provenance": {
          "build_identity": "rumi_context_runtime_pack:1.0.0",
          "content_hash": "sha256:0f5cf7acdb2419c0f921b100506eee87acd21681a4f7ae88814a999a97deea33",
          "signature": null,
          "trust_class": "local"
        },
        "required_capabilities": [
          "context.materialize"
        ],
        "required_network": {
          "allowed_domains": [],
          "allowed_ports": []
        },
        "required_secrets": [],
        "resources": [],
        "version": "1.0.0",
        "vocabulary": {
          "types": [
            "service"
          ]
        }
      },
      "pack_id": "rumi_context_runtime_pack"
    }
  },
  "migration": {
    "compatibility_aliases": [],
    "compatibility_projection": "none",
    "from": [
      "defaultspack.domain.context"
    ],
    "removal_wave": 10,
    "rollback": "Remove the stateless projection; no owner data exists.",
    "sunset_at": "2027-12-31"
  },
  "pack": {
    "description": "Deterministic non-authoritative context materialization.",
    "display_name": "Rumi Context Runtime",
    "id": "rumi.context_runtime",
    "kind": "service",
    "version": "1.0.0"
  },
  "pack_api_version": "rumi.pack.v3",
  "permissions": [
    {
      "access": "read",
      "approval_required": false,
      "capability": "context.materialize"
    }
  ],
  "provenance": {
    "build_identity": "rumi_context_runtime_pack:1.0.0",
    "content_hash": "sha256:0f5cf7acdb2419c0f921b100506eee87acd21681a4f7ae88814a999a97deea33",
    "signature": null,
    "trust_class": "local"
  },
  "resources": [],
  "storage": []
}
